{
  "$schema": "https://json-schema.org/draft/2020-12/schema",
  "$id": "https://hal100.local/contracts/agent-rpc/v12.schema.json",
  "title": "HAL100 Agent RPC v12 Envelope",
  "type": "object",
  "additionalProperties": false,
  "required": ["protocolVersion", "id", "kind", "payload"],
  "properties": {
    "protocolVersion": { "const": 12 },
    "id": { "type": "string", "minLength": 1, "maxLength": 128 },
    "kind": {
      "type": "string",
      "minLength": 1,
      "maxLength": 128,
      "pattern": "^[a-z][a-z0-9]*(\\.[a-z][a-z0-9]*)+$"
    },
    "payload": {}
  }
}
